{"id": "warlord_bridge", "size": [14, 12], "tiles": "AgAAAgAAAgAAAgAAAgAAAAIQAAIQAAIQAAIQAgAAAgAABAQABAQABAQAAgAAAgAAAgAAAgAAAgAAAAIQAAIQAAIQAAIQAgAAAgAABAQABAQABAQAAgAAAgAAAgAAAgAAAgAAAAIQAAIQAAIQAAIQAgAAAgAABAQABAQABAQAAgAAAgAAAgAAAgAAAgAAAAIQAAIQAAIQAAIQAgAAAgAAAwQAAwQAAwQAAgAAAgAAAgAAAgAAAgAAAAIQAAIQAAIQAAIQAgAAAgAAAgAAAgAAAgAAAgAAAgAAAgAAAgEAAgEAAgMAAgMAAgMAAgMAAgEAAgEAAgAAAgAAAgAAAgAAAgAAAgAAAgEAAgEAAgMAAgMAAgMAAgMAAgEAAgEAAgAAAgAAAgAAAgAAAgAAAgAAAgAAAgAAAAIQAAIQAAIQAAIQAgAAAgAAAgAAAgAAAgAAAgAAAgAAAgAAAgAAAgAAAAIQAAIQAAIQAAIQAgAAAgAAAgAAAgAAAgAAAgAAAgAAAgAAAgAAAgAAAAIQAAIQAAIQAAIQAgAAAgAAAgAAAgAAAgAAAgAAAgAAAgAAAgAAAgAAAQQCAQQCAQQCAQQCAgAAAgAAAgAAAgAAAgAAAgAAAgAAAgAAAgAAAgAAAAIQAAIQAAIQAAIQAgAAAgAAAgAAAgAAAgAA", "materials": ["grass/lush", "dirt/dark", "void/deep", "mine_boards/oak", "rock/grey"],
  "props": [{"id": "crate", "at": [3, 3], "blocks": true, "cover": "three_quarters"}, {"id": "crate", "at": [2, 8], "blocks": true, "cover": "three_quarters"}, {"id": "rock_large", "at": [10, 8], "blocks": true, "cover": "three_quarters"}, {"id": "crate", "at": [12, 7], "blocks": true, "cover": "half"}],
  "zones": {"party_spawn": [[1, 4], [1, 5], [1, 6], [1, 7], [2, 5], [2, 6]], "bridge": [[5, 5], [6, 5], [7, 5], [8, 5], [5, 6], [6, 6], [7, 6], [8, 6]], "east_bank": [[10, 4], [10, 7], [11, 4], [11, 7], [12, 5], [12, 6]], "ridge_spawn": [[11, 1], [12, 1], [13, 1], [12, 0], [13, 0]], "ford": [[5, 10], [6, 10], [7, 10], [8, 10]]}}
