{ "id": "field", "size": [6, 5],
  "tiles": "AAEAAAEAAAIDAAEAAgEAAgEAAAAAAAAAAAIDAAAAAgAAAgAAAAAAAAAAAAIDAAAAAgAAAgAAAAAAAAAAAAIDAAAAAgAAAgAAAAAAAAAAAAIDAAAAAgAAAgAA",
  "materials": ["grass/lush", "dirt/dark", "water/river"],
  "props": [ { "id": "crate", "at": [3, 2], "blocks": true, "cover": "three_quarters" },
             { "id": "bush", "at": [1, 1], "blocks": false, "cover": "half" } ],
  "zones": { "party_spawn": [[0, 3], [0, 4], [1, 3], [1, 4]], "enemy_spawn": [[5, 0], [5, 1], [5, 2]], "exit": [[5, 4]] } }
