{ "id": "crypt_hall", "size": [14, 12],
  "tiles": "AgMEAgMEAgMEAgMEAgMEAgMEAgMEAgMEAgMEAgMEAgMEAgMEAgMEAgMEAAAAAAAAAAEAAAAAAAAAAAEAAAAAAAAAAAEAAAAAAQIAAQIAAQIAAQIAAAAAAAEAAAAAAAAAAAEAAAAAAAAAAAEAAAAAAAAAAQIAAQIAAQIAAQIAAAEAAAAAAAAAAAEAAAAAAAAAAAEAAAAAAAAAAAEAAQIAAQIAAQIAAQIAAAAAAAAAAAEAAAAAAAAAAAEAAAAAAAAAAAEAAAAAAQIAAQIAAQIAAQIAAAAAAAEAAAAAAAAAAAEAAAAAAAAAAAEAAAAAAAAAAAEAAAAAAAAAAAEAAAEAAAAAAAAAAAEAAAAAAAAAAAEAAAAAAAAAAAEAAAAAAAAAAAEAAAAAAAAAAAAAAAEAAAAAAAAAAAEAAAAAAAAAAAEAAAAAAAAAAAEAAAAAAAAAAAAAAAEAAAAAAAAAAAEAAAAAAAAAAAEAAAAAAAAAAAEAAAAAAAAAAAEAAAEAAAAAAAAAAAEAAAAAAAAAAAEAAAAAAAAAAAEAAAAAAAAAAAEAAAAAAAAAAAAAAAEAAAAAAAAAAAEAAAAAAAAAAAEAAAAAAAAAAAEAAAAAAAAAAAAAAAEAAAAAAAAAAAEAAAAAAAAAAAEAAAAAAAAAAAEAAAAAAAAAAAEA",
  "materials": ["dungeon_floor/dark", "dungeon_floor_mossy/dark", "crypt_tile/dark", "dungeon_wall/dark"],
  "props": [
    { "id": "sarcophagus", "at": [4, 4], "blocks": true, "cover": "three_quarters" },
    { "id": "sarcophagus_open", "at": [4, 7], "blocks": true, "cover": "half" },
    { "id": "brazier", "at": [9, 2], "blocks": true, "cover": "half" },
    { "id": "brazier", "at": [9, 4], "blocks": true, "cover": "half" },
    { "id": "altar_runes", "at": [12, 2], "blocks": true, "cover": "three_quarters" }
  ],
  "zones": {
    "party_spawn": [[1, 9], [2, 9], [1, 10], [2, 10], [3, 10], [2, 11]],
    "nave": [[6, 5], [7, 5], [6, 6], [7, 6], [8, 6], [8, 7]],
    "dais": [[10, 2], [11, 2], [10, 3], [11, 3]],
    "alcove": [[9, 7], [10, 7], [9, 8], [10, 8]],
    "exit": [[13, 2], [13, 3]]
  } }
