{"id": "keep_gate", "size": [14, 12], "tiles": "AAAAAAAAAAAAAAAAAAAAAAAABAIEBAIEAwMAAwMAAgMAAQQAAQQAAQQAAAAAAAAAAQEAAQEAAAAAAAAABAIEBAIEAwMAAwMAAgMAAQQAAQQAAQQAAAAAAAAAAQEAAQEAAAAAAAAABAIEBAIEAwMAAwMAAgMAAQQAAQQAAQQAAAAAAAAAAAAAAAAAAAAAAAAABAIEBAIEAQQAAQQAAQQAAQQAAQQAAQQAAAAAAAAAAAAAAAAAAAAAAAAAAQUAAQUAAQQAAQQAAQQAAQQAAQQAAQQAAAAAAAAAAAAAAAAAAAAAAAAAAQUAAQUAAQQAAQQAAQQAAQQAAQQAAQQAAAAAAAAAAAAAAAAAAAAAAAAAAQUAAQUAAQQAAQQAAQQAAQQAAQQAAQQAAAAAAAAAAAAAAAAAAAAAAAAAAQUAAQUAAQQAAQQAAQQAAQQAAQQAAQQAAAAAAAAAAAAAAAAAAAAAAAAABAIEBAIEAQQAAQQAAQQAAQQAAQQAAQQAAAAAAAAAAAAAAAAAAAAAAAAABAIEBAIEAwMAAwMAAgMAAQQAAQQAAQQAAAAAAAAAAQEAAQEAAAAAAAAABAIEBAIEAwMAAwMAAgMAAQQAAQQAAQQAAAAAAAAAAAAAAAAAAAAAAAAABAIEBAIEAwMAAwMAAgMAAQQAAQQAAQQA", "materials": ["cobble/grey", "rock/grey", "dungeon_wall/grey", "flagstone/grey", "flagstone/dark", "dungeon_floor_cracked/grey"],
  "props": [{"id": "rubble", "at": [6, 4], "blocks": false, "cover": "half"}, {"id": "boulder", "at": [7, 7], "blocks": true, "cover": "three_quarters"}, {"id": "rubble", "at": [4, 5], "blocks": false, "cover": "half"}, {"id": "rock_medium", "at": [3, 8], "blocks": true, "cover": "half"}, {"id": "rubble", "at": [10, 6], "blocks": false, "cover": "half"}, {"id": "statue_knight", "at": [12, 3], "blocks": true, "cover": "three_quarters"}, {"id": "statue_knight", "at": [12, 8], "blocks": true, "cover": "three_quarters"}],
  "zones": {"party_spawn": [[1, 4], [1, 5], [1, 6], [1, 7], [2, 5], [2, 6]], "gate": [[6, 4], [7, 4], [6, 5], [7, 5], [6, 6], [7, 6], [6, 7]], "north_rampart": [[8, 1], [9, 1], [8, 2], [9, 2]], "south_rampart": [[8, 9], [9, 9], [8, 10], [9, 10]], "courtyard": [[11, 5], [11, 6], [12, 5], [12, 6]], "exit": [[13, 5], [13, 6]]}}
