{"id": "hall_of_the_flame", "size": [14, 12], "tiles": "BAEEBAEEBAEEBAEEBAEEBAEEBAEEBAEEBAEEBAEEBAEEBAEEBAEEBAEEAQAAAQAAAQAAAQAAAQAAAAIYAQAAAgQAAgQAAQAAAQAAAgQAAgQAAQAAAQAAAQAAAQAAAQAAAQAAAAIYAQAAAgQAAgQAAAIYAAIYAgQAAgQAAQAAAQAAAQAAAQAAAQAAAQAAAQAAAQAAAQAAAgQAAAIYAAIYAgQAAQAAAgUAAQAAAQAAAQAAAQAAAQAAAAIYAQAAAgQAAwMAAwMAAwMAAwMAAgQAAgUAAQAAAQAAAQAAAQAAAQAAAAIYAQAAAgQAAwMAAwMAAwMAAwMAAgQAAgUAAQAAAQAAAQAAAQAAAQAAAQAAAQAAAgQAAwMAAwMAAwMAAwMAAgQAAgUAAQAAAQAAAQAAAQAAAQAAAQAAAQAAAQAAAgQAAAIYAAIYAgQAAQAAAgUAAQAAAQAAAQAAAQAAAQAAAAIYAQAAAgQAAgQAAAIYAAIYAgQAAgQAAQAAAQAAAQAAAQAAAQAAAQAAAAIYAQAAAgQAAgQAAQAAAQAAAgQAAgQAAQAAAQAAAQAAAQAAAQAAAQAAAQAAAQAAAQAAAQAAAQAAAQAAAQAAAQAAAQAAAQAAAQAAAQAAAQAAAQAAAQAAAQAAAQAAAQAAAQAAAQAAAQAAAQAAAQAA", "materials": ["flagstone/dark", "dungeon_wall/dark", "lava/molten", "crypt_tiles/fel", "dungeon_floor/warm", "basalt/dark"],
  "props": [{"id": "altar_runes", "at": [9, 5], "blocks": true, "cover": "three_quarters"}, {"id": "pillar", "at": [3, 2], "blocks": true, "cover": "three_quarters"}, {"id": "pillar", "at": [3, 8], "blocks": true, "cover": "three_quarters"}, {"id": "pillar", "at": [6, 4], "blocks": true, "cover": "three_quarters"}, {"id": "pillar_broken", "at": [9, 10], "blocks": true, "cover": "half"}, {"id": "brazier", "at": [7, 3], "blocks": true, "cover": "half"}, {"id": "brazier", "at": [7, 7], "blocks": true, "cover": "half"}],
  "zones": {"party_spawn": [[1, 9], [2, 9], [1, 10], [2, 10], [3, 10], [2, 11]], "heart": [[8, 4], [9, 4], [10, 4], [11, 4], [8, 5], [10, 5], [11, 5], [8, 6], [9, 6], [10, 6], [11, 6]], "north_gallery": [[7, 1], [8, 1], [11, 1], [12, 1]], "south_gallery": [[7, 9], [8, 9], [11, 9], [12, 9]], "dragon_roost": [[13, 5], [13, 4], [13, 6], [13, 3], [13, 7]]}}
